id;date_create;date_edit;creator;editor
1;2019-05-31T10:10:26;2019-05-31T13:55:20;Small back-end;Bacon Handmade Metal Bacon quantifying
2;2019-05-31T05:25:45;2019-05-30T22:18:46;Dominican Peso Bedfordshire intuitive;Money Market Account relationships Investment Account
3;2019-05-30T20:06:31;2019-05-31T07:44:59;Orchestrator Upgradable;capacity
4;2019-05-31T05:46:07;2019-05-30T18:38:14;New Mexico Savings Account navigating;Extension channels
5;2019-05-31T10:06:36;2019-05-30T20:48:21;Auto Loan Account turquoise Metal;Investor
6;2019-05-31T11:07:14;2019-05-31T14:23:09;Beauty;wireless Clothing
7;2019-05-30T14:46:21;2019-05-31T04:03:57;Indian Rupee France;Keyboard multi-byte Optimization
8;2019-05-31T04:27:40;2019-05-31T09:43:17;transmit homogeneous whiteboard;communities Michigan
9;2019-05-31T12:59:44;2019-05-31T03:01:42;back up transmit Bacon;Total array
10;2019-05-31T02:50:14;2019-05-31T03:02:20;copy Home Loan Account;Graphic Interface
